"procedure_code","block","procedure_desc","procedure_short_desc"
"9048600","1333","Epidural injection of local anaesthetic during labour","Epidural injection of LA during labour"
"9048601","1333","Epidural injection of opioid during labour","Epidural injection opioid during labour"
"9048602","1333","Epidural injection of other therapeutic substance during labour","Epidural inj/o other thrpc during labour"
"9048700","1330","Other intrauterine diagnostic procedure on fetus","Oth intrauterine dx proc on fetus"
"9048800","1330","Endoscopic ablation of vessels of placenta","Endoscopic ablation vessels placenta"
"9053000","1367","Closed reduction of fracture of mandibular or maxillary alveolar ridge","Close rdctn fx man/max alveolar rdge"
"9053001","1367","Open reduction of fracture of mandibular or maxillary alveolar ridge","Open rdctn fx mand/max alveolar ridge"
"9053002","1370","Closed reduction of fracture of facial bone, not elsewhere classified","Closed rdctn fx facial bone, NEC"
"9053003","1370","Open reduction of fracture of facial bone, not elsewhere classified","Open rdctn fx facial bone NEC"
"9053100","1870","Traction, not elsewhere classified","Traction, not elsewhere classified"
"9053200","1394","Fitting of prosthesis of arm and shoulder","Fitting of prosthesis of arm & shoulder"
"9053300","1404","Other repair of shoulder","Other repair of shoulder"
"9053400","1409","Fitting of prosthesis of arm, not otherwise classified","Fitting of prosthesis of arm, NEC"
"9053500","1412","Disarticulation at elbow","Disarticulation at elbow"
"9053600","1418","Other repair of elbow","Other repair of elbow"
"9053700","1419","Revision arthroplasty of elbow","Revision arthroplasty of elbow"
"9053800","1422","Fitting of prosthesis of forearm and hand","Fitting of prosthesis of forearm & hand"
"9053900","1409","Implantation of prosthetic device of arm","Implantation of prosthetic device of arm"
"9054000","1425","Tenolysis of flexor or extensor tendon of forearm or wrist","Tenolysis flex/extens tend forearm/wrist"
"9054100","1434","Closed reduction of separated epiphysis of radius or ulna","Clsd rdctn sep epiphys radius/ulna"
"9054101","1434","Open reduction of separated epiphysis of radius or ulna","Open rdctn sep epiphys radius/ulna"
"9054200","1468","Other repair of wrist","Other repair of wrist"
"9054300","1472","Revision arthroplasty of wrist","Revision arthroplasty of wrist"
"9054400","1440","Division of adhesions of hand","Division of adhesions of hand"
"9054500","1440","Incision of soft tissue of hand","Incision of soft tissue of hand"
"9054600","1450","Excision of lesion of soft tissue of hand, not elsewhere classified","Excision lesion of soft tissue hand, NEC"
"9054601","1450","Excision of lesion of muscle of hand, not elsewhere classified","Excision of lesion of muscle of hand NEC"
"9054700","1467","Repair of muscle or fascia of hand, not elsewhere classified","Repair of muscle or fascia of hand, NEC"
"9054800","1467","Other plastic procedures on hand","Other plastic procedures on hand"
"9054900","1469","Reconstruction of thumb","Reconstruction of thumb"
"9055000","1477","Fitting of prosthesis above knee","Fitting of prosthesis above knee"
"9055001","1496","Fitting of prosthesis of leg, not elsewhere classified","Fitting of prosthesis of leg, NEC"
"9055100","1496","Implantation of prosthetic device of leg","Implantation of prosthetic device of leg"
"9055200","1491","Other repair of hip","Other repair of hip"
"9055300","1496","Fitting of prosthesis below knee","Fitting of prosthesis below knee"
"9055400","1499","Wedge osteotomy of tibia","Wedge osteotomy of tibia"
"9055500","1499","Osteotomy of patella","Osteotomy of patella"
"9055600","1530","Tenolysis of Achilles' flexor or extensor tendon of foot","Tenolysis Achilles' flexor/extensor tend"
"9055700","1533","Disarticulation through toe","Disarticulation through toe"
"9055800","1539","Open reduction of fracture of ankle","Open reduction of fracture of ankle"
"9055900","1543","Arthrodesis of toe","Arthrodesis of toe"
"9056000","1552","Administration of other agent into soft tissue, not elsewhere classified","Admin of other agt into soft tissue NEC"
"9056100","1554","Insertion or replacement of skeletal muscle stimulator","Ins/replace skeletal muscle stimulator"
"9056200","1524","Patella resurfacing","Patella resurfacing"
"9056300","1553","Aspiration of soft tissue, not elsewhere classified","Aspiration of soft tissue, NEC"
"9056400","1554","Implantation or fitting of prosthetic limb device, not elsewhere classified","Impl or fitting prosthetic limb dev NEC"
"9056500","1554","Removal of orthopaedic prosthesis, not elsewhere classified","Removal orthopaedic prosthesis NEC"
"9056600","1554","Removal of skeletal muscle stimulator","Removal of skeletal muscle stimulator"
"9056700","1558","Fasciotomy for upper limb ischaemia","Fasciotomy for upper limb ischaemia"
"9056701","1558","Fasciotomy for lower limb ischaemia","Fasciotomy for lower limb ischaemia"
"9056800","1559","Incision of muscle, not elsewhere classified","Incision of muscle, NEC"
"9056801","1559","Incision of bursa, not elsewhere classified","Incision of bursa, NEC"
"9056802","1559","Incision of soft tissue, not elsewhere classified","Incision of soft tissue, NEC"
"9056900","1556","Osteotomy, not elsewhere classified","Osteotomy, not elsewhere classified"
"9057000","1555","Division of joint capsule, ligament or cartilage, not elsewhere classified","Div jt capsule, ligament, cartilage NEC"
"9057100","1559","Division of adhesions of soft tissue, not elsewhere classified","Div adhes soft tissue NEC"
"9057200","1563","Ostectomy, not elsewhere classified","Ostectomy, not elsewhere classified"
"9057300","1563","Sequestrectomy of other and unspecified musculoskeletal site","Sequestrectomy other & unsp M/S site"
"9057400","1561","Excision of lesion of joint, not elsewhere classified","Excision of lesion of joint, NEC"
"9057401","1561","Excision of joint, not elsewhere classified","Excision of joint, NEC"
"9057500","1566","Excision of soft tissue, not elsewhere classified","Excision of soft tissue, NEC"
"9057600","1393","Spinal fixation without fusion for scoliosis or kyphosis","Spinal fix wo fusion, scoliosis/kyphosis"
"9057700","1565","Procurement of muscle or fascia for graft","Procurement muscle or fascia for graft"
"9057800","1564","Procurement of tendon for graft","Procurement of tendon for graft"
"9057900","1566","Fasciectomy, not elsewhere classified","Fasciectomy, not elsewhere classified"
"9058000","1566","Debridement of open fracture site","Debridement of open fracture site"
"9058100","1567","Reduction of separated epiphysis, not elsewhere classified","Reduction of separated epiphysis, NEC"
"9058200","1568","Suture of ligament, not elsewhere classified","Suture of ligament, NEC"
"9058201","1568","Suture of tendon, not elsewhere classified","Suture of tendon, NEC"
"9058202","1568","Suture of muscle or fascia, not elsewhere classified","Suture of muscle or fascia, NEC"
"9058300","1569","Tendon graft, not elsewhere classified","Tendon graft, not elsewhere classified"
"9058301","1569","Muscle graft, not elsewhere classified","Muscle graft, not elsewhere classified"
"9058400","1572","Transposition of tendon, not elsewhere classified","Transposition of tendon, NEC"
"9058401","1572","Reattachment of tendon, not elsewhere classified","Reattachment of tendon, NEC"
"9058500","1573","Reattachment of muscle, not elsewhere classified","Reattachment of muscle, NEC"
"9058600","1573","Other plastic procedures on muscle, not elsewhere classified","Other plastic procedures on muscle, NEC"
"9058700","1551","Replacement of cast on upper limb","Replacement of cast on upper limb"
"9058701","1551","Replacement of cast on lower limb","Replacement of cast on lower limb"
"9058702","1551","Replacement of cast of other site","Replacement of cast of other site"
"9058703","1551","Replacement of other device for musculoskeletal immobilisation","Replace other device for M/S immobilsn"
"9058800","1571","Osteoclasis","Osteoclasis"
"9058900","1571","Repair of bone, not elsewhere classified","Repair of bone, not elsewhere classified"
"9058901","1574","Repair of ligament, not elsewhere classified","Repair of ligament, NEC"
"9059000","1576","Tendon pulley reconstruction, not elsewhere classified","Tendon pulley reconstruction, NEC"
"9059100","1577","Procedure for acute osteomyelitis of site, not elsewhere classified","Proc for acute osteomyelitis of site NEC"
"9059101","1577","Procedure for chronic osteomyelitis of site, not elsewhere classified","Proc chronic osteomyelitis of site NEC"
"9059200","1579","Separation of equal conjoined twins","Separation of equal conjoined twins"
"9059201","1579","Separation of unequal conjoined twins","Separation of unequal conjoined twins"
"9059300","1579","Other diagnostic procedures on muscle, tendon, fascia or bursa, not elsewhere classified","Oth dx proc muscle tend fascia bursa NEC"
"9059301","1579","Other procedures on muscle, tendon, fascia or bursa, not elsewhere classified","Oth proc muscle tendon fascia bursa NEC"
"9059400","1579","Other diagnostic procedures on bone or joint, not elsewhere classified","Other dx proc on bone or joint NEC"
"9059500","1579","Other procedures on musculoskeletal system, not elsewhere classified","Other proc musculoskeletal system NEC"
"9059600","1378","Rewiring of sternum","Rewiring of sternum"
"9059700","1436","Silastic replacement of distal ulna","Silastic replacement of distal ulna"
"9059800","1520","Other repair of knee","Other repair of knee"
"9059900","1544","Other repair of ankle","Other repair of ankle"
"9060000","1395","Arthroscopic release of adhesions or contracture of shoulder","Arthro release adhes/contract shoulder"
"9060001","1395","Release of adhesions or contracture of shoulder","Release adhesions/contracture shoulder"
"9060100","1554","Arthroscopic lavage of joint, not elsewhere classified","Arthroscopic lavage of joint, NEC"
"9060101","1554","Lavage of joint, not elsewhere classified","Lavage of joint, NEC"
"9060200","1382","Biopsy of intervertebral disc","Biopsy of intervertebral disc"
"9060300","1364","Sequestrectomy of maxilla","Sequestrectomy of maxilla"
"9060301","1364","Sequestrectomy of mandible","Sequestrectomy of mandible"
"9060302","1376","Sequestrectomy of sternum","Sequestrectomy of sternum"
"9060303","1376","Sequestrectomy of rib","Sequestrectomy of rib"
"9060304","1385","Sequestrectomy of vertebra","Sequestrectomy of vertebra"
"9060305","1385","Sequestrectomy of vertebra with spinal cord involvement","Sequestrectomy of vertebra w cord inv"
"9060306","1400","Sequestrectomy of clavicle","Sequestrectomy of clavicle"
"9060307","1400","Sequestrectomy of scapula","Sequestrectomy of scapula"
"9060308","1412","Sequestrectomy of humerus","Sequestrectomy of humerus"
"9060309","1426","Sequestrectomy of radius","Sequestrectomy of radius"
"9060310","1426","Sequestrectomy of ulna","Sequestrectomy of ulna"
"9060311","1451","Sequestrectomy of carpus","Sequestrectomy of carpus"
"9060312","1450","Sequestrectomy of metacarpus","Sequestrectomy of metacarpus"
"9060313","1450","Sequestrectomy of phalanx of hand","Sequestrectomy of phalanx of hand"
"9060314","1485","Sequestrectomy of pelvic bones","Sequestrectomy of pelvic bones"
"9060315","1485","Sequestrectomy of femur","Sequestrectomy of femur"
"9060316","1504","Sequestrectomy of tibia","Sequestrectomy of tibia"
"9060317","1504","Sequestrectomy of fibula","Sequestrectomy of fibula"
"9060318","1534","Sequestrectomy of tarsus","Sequestrectomy of tarsus"
"9060319","1534","Sequestrectomy of metatarsus","Sequestrectomy of metatarsus"
"9060320","1534","Sequestrectomy of phalanx of foot","Sequestrectomy of phalanx of foot"
"9060400","1578","Correction of bony deformity","Correction of bony deformity"
"9060500","1578","Compression with distraction osteosynthesis","Compression w distraction osteosynthesis"
"9060501","1578","Osteosynthesis, not elsewhere classified","Osteosynthesis, NEC"
"9060600","1661","Removal of facial implant","Removal of facial implant"
"9060601","1661","Removal of other soft tissue implant","Removal of other soft tissue implant"
"9060602","221","Removal of orbital implant","Removal of orbital implant"
"9060700","1489","Resurfacing of hip, unilateral","Resurfacing of hip, unilateral"
"9060701","1489","Resurfacing of hip, bilateral","Resurfacing of hip, bilateral"
"9060800","1561","Procurement of cartilage","Procurement of cartilage"
"9060801","1561","Arthroscopic procurement of cartilage","Arthroscopic procurement of cartilage"
"9060900","1579","Destruction of bone","Destruction of bone"
"9061000","1377","Closed reduction of rib","Closed reduction of rib"
"9061001","1377","Open reduction of rib","Open reduction of rib"
"9061100","1522","Patellar tendon shortening","Patellar tendon shortening"
"9061101","1522","Patellar tendon advancement","Patellar tendon advancement"
"9061200","1544","Os calcis lengthening","Os calcis lengthening"
"9061300","1579","Arthroscopic procedure proceeding to open procedure","Arthro proc proceeding to open proc"
"9065900","1686","Excision of flap monitoring tissue","Excision of flap monitoring tissue"
"9066000","1602","Administration of agent into skin and subcutaneous tissue","Administration of agent into SSCT"
"9066100","1608","Other incision of skin and subcutaneous tissue","Other incision of SSCT"
"9066200","1617","Laser to tattoo","Laser to tattoo"
"9066300","1617","Ligation of dermal appendage","Ligation of dermal appendage"
"9066400","1625","Excision of lesion of skin and subcutaneous tissue of eyelid, not elsewhere classified","Excision lesion SSCT of eyelid NEC"
"9066401","1625","Excision of lesion of skin and subcutaneous tissue of nose, not elsewhere classified","Excision lesion SSCT of nose, NEC"
"9066402","1625","Excision of lesion of skin and subcutaneous tissue of ear, not elsewhere classified","Excision lesion SSCT of ear, NEC"
"9066403","1625","Excision of lesion of skin and subcutaneous tissue of lip, not elsewhere classified","Excision lesion SSCT of lip, NEC"
"9066404","1625","Excision of lesion of skin and subcutaneous tissue of other site of head, not elsewhere classified","Exc lesion SSCT, other site of head NEC"
"9066405","1625","Excision of lesion of skin and subcutaneous tissue of neck, not elsewhere classified","Excision lesion SSCT of neck, NEC"
"9066406","1625","Excision of lesion of skin and subcutaneous tissue of hand, not elsewhere classified","Excision lesion SSCT of hand, NEC"
"9066407","1625","Excision of lesion of skin and subcutaneous tissue of digit, not elsewhere classified","Excision lesion SSCT of digit, NEC"
"9066408","1625","Excision of lesion of skin and subcutaneous tissue of genitals, not elsewhere classified","Excision lesion SSCT, genitals NEC"
"9066409","1625","Excision of lesion of skin and subcutaneous tissue of leg, not elsewhere classified","Excision lesion SSCT of leg, NEC"
"9066410","1625","Excision of lesion of skin and subcutaneous tissue of foot, not elsewhere classified","Excision lesion SSCT of foot, NEC"
"9066411","1625","Excision of lesion of skin and subcutaneous tissue of other site, not elsewhere classified","Excision lesion SSCT, oth site NEC"
"9066500","1628","Excisional debridement of skin and subcutaneous tissue","Exc debridement skin & sbc tissue"
"9066600","1629","Removal of allograft","Removal of allograft"
"9066601","1629","Removal of allograft to burn","Removal of allograft to burn"
"9066700","1629","Removal of xenograft","Removal of xenograft"
"9066701","1629","Removal of xenograft to burn","Removal of xenograft to burn"
"9066800","1629","Removal of synthetic skin graft","Removal of synthetic skin graft"
"9066801","1629","Removal of synthetic skin graft to burn","Removal of synthetic skin graft to burn"
"9066900","1634","Excision of skin for graft","Excision of skin for graft"
"9067000","1640","Allograft","Allograft"
"9067001","1640","Allograft to burn","Allograft to burn"
"9067100","1640","Xenograft","Xenograft"
"9067101","1640","Xenograft to burn","Xenograft to burn"
"9067200","1640","Synthetic skin graft","Synthetic skin graft"
"9067201","1640","Synthetic skin graft to burn","Synthetic skin graft to burn"
"9067300","1655","Correction of syndactyly","Correction of syndactyly"
"9067400","1655","Replantation of scalp","Replantation of scalp"
"9067500","1655","Other repair of skin and subcutaneous tissue","Other repair of SSCT"
"9067600","1660","Other procedures on skin and subcutaneous tissue","Other proc on skin & subcutaneous tissue"
"9067700","1611","Other phototherapy, skin","Other phototherapy, skin"
"9067800","1701","Partial resection of other facial bone, not elsewhere classified","Partial resection oth facial bone NEC"
"9067801","1701","Subtotal resection of other facial bone, not elsewhere classified","Subtot resection oth facial bone NEC"
"9067802","1701","Total resection of other facial bone, not elsewhere classified","Total resection other facial bone NEC"
"9067900","1703","Osteotomy of zygoma, unilateral","Osteotomy of zygoma, unilateral"
"9067901","1703","Osteotomy of zygoma, bilateral","Osteotomy of zygoma, bilateral"
"9067902","1703","Ostectomy of zygoma, unilateral","Ostectomy of zygoma, unilateral"
"9067903","1703","Ostectomy of zygoma, bilateral","Ostectomy of zygoma, bilateral"
"9068000","1704","Osteotomy of zygoma with internal fixation, unilateral","Osteotomy of zygoma w int fixation, uni"
"9068001","1704","Osteotomy of zygoma with internal fixation, bilateral","Osteotomy of zygoma w int fixation, bil"
"9068002","1704","Ostectomy of zygoma with internal fixation, unilateral","Ostectomy of zygoma w int fixation, uni"
"9068003","1704","Ostectomy of zygoma with internal fixation, bilateral","Ostectomy of zygoma w int fixation, bil"
"9068100","1712","Other repair of facial bone","Other repair of facial bone"
"9068300","1715","Reconstruction of zygoma","Reconstruction of zygoma"
"9068400","1717","Other reconstruction of facial bone","Other reconstruction of facial bone"
"9068600","1627","Nonexcisional debridement of burn","Nonexcisional debridement of burn"
"9068601","1628","Nonexcisional debridement of skin and subcutaneous tissue","Non exc debridement skin & sbc tissue"
"9072000","1759","Other procedures on breast","Other procedures on breast"
"9072100","1740","Manual examination of breast","Manual examination of breast"
"9072200","1755","Suture of laceration of breast","Suture of laceration of breast"
"9072300","1741","Injection into breast for augmentation, unilateral","Injection breast for augmentation, uni"
"9072301","1741","Injection into breast for augmentation, bilateral","Injection breast for augmentation, bil"
"9072400","1740","Breast stereotactic localisation","Breast stereotactic localisation"
"9072500","1741","Aspiration of breast","Aspiration of breast"
"9072600","1759","Other destruction of breast","Other destruction of breast"
"9076000","1780","Chemotherapy, oral administration","Chemotherapy, oral administration"
"9076200","1922","Treatment planning of pharmacotherapy, primary course","Rx planning of pharmac course"
"9076201","1922","Treatment planning of pharmacotherapy, secondary course","Rx plan of pharmac, sec course"
"9076400","1791","Brachytherapy, intracavitary, low dose rate","Brachythrpy intracavitary low dose rate"
"9076401","1791","Brachytherapy, intracavitary, high dose rate","Brachythrpy intracavitary high dose rate"
"9076500","1797","Construction and fitting of immobilisation device, simple","Construct & fitting immobils dev simple"
"9076501","1797","Construction and fitting of immobilisation device, intermediate","Construct, fitting immobils dev intrmed"
"9076502","1797","Construction and fitting of immobilisation device, complex","Construct & fitting immobils dev complx"
"9076503","1797","Construction and fitting of customised blocks","Construction & fitting customised blocks"
"9076504","1797","Construction and fitting of treatment accessories","Construction & fitting Rx accessories"
"9076600","1794","Brachytherapy using surface applicators, other sites","Brachythrpy, surf applicators oth sites"
"9076700","1780","Chemotherapy, subcutaneous or intramuscular administration","Chemotherapy, subc/intramuscular admin"
"9076800","1780","Chemotherapy, other administration","Chemotherapy, other administration"
"9076900","940","Insertion of artificial bowel sphincter","Insertion of artificial bowel sphincter"
"9076901","940","Revision of artificial bowel sphincter","Revision of artificial bowel sphincter"
"9076902","940","Removal of artificial bowel sphincter","Removal of artificial bowel sphincter"
"9077000","1859","Testing of implanted anal pacemaker","Testing of implanted anal pacemaker"
"9077100","1005","Panendoscopy via camera capsule","Panendoscopy via camera capsule"
"9077200","1860","Cystometrography with contrast micturating cystourethrography","CMG w contrst mict cystourethrography"
"9090000","1967","Encephalography","Encephalography"
"9090100","2015","Magnetic resonance imaging of brain","Magnetic resonance imaging of brain"
"9090101","2015","Magnetic resonance imaging of head","Magnetic resonance imaging of head"
"9090102","2015","Magnetic resonance imaging of neck","Magnetic resonance imaging of neck"
"9090103","2015","Magnetic resonance imaging of spine","Magnetic resonance imaging of spine"
"9090104","2015","Magnetic resonance imaging of chest","Magnetic resonance imaging of chest"
"9090105","2015","Magnetic resonance imaging of abdomen","Magnetic resonance imaging of abdomen"
"9090106","2015","Magnetic resonance imaging of pelvis","Magnetic resonance imaging of pelvis"
"9090107","2015","Magnetic resonance imaging of extremity","Magnetic resonance imaging of extremity"
"9090108","2015","Magnetic resonance imaging of other site","Magnetic resonance imaging of other site"
"9090109","2015","Functional magnetic resonance imaging of brain","Functional MRI of brain"
"9090110","2015","Magnetic resonance imaging of breast","Magnetic resonance imaging of breast"
"9090200","1991","Magnetic resonance angiography of head or neck","Magnetic resonance angiography head/neck"
"9090201","1991","Magnetic resonance angiography of upper limb","Magnetic resonance angiography upp limb"
"9090202","1991","Magnetic resonance angiography of chest","Magnetic resonance angiography of chest"
"9090203","1991","Magnetic resonance angiography of spine","Magnetic resonance angiography of spine"
"9090204","1991","Magnetic resonance angiography of abdomen","Magnetic resonance angiography, abdomen"
"9090205","1991","Magnetic resonance angiography of pelvis","Magnetic resonance angiography, pelvis"
"9090206","1991","Magnetic resonance angiography of lower limb","Magnetic resonance angiography low limb"
"9090207","1991","Magnetic resonance angiography of other site","Magnetic resonance angiography, oth site"
"9090300","1988","Radiography of soft tissue, not elsewhere classified","Radiography of soft tissue, NEC"
"9090400","2016","Thermography, not elsewhere classified","Thermography, not elsewhere classified"
"9090500","2000","Cerebral positron emission tomography [PET]","Cerebral positron emission tomography"
"9090501","2003","Myocardial positron emission tomography [PET]","Myocardial positron emission tomography"
"9090502","2012","Whole body study with positron emission tomography [PET]","Whole body study with PET"
"9090503","2013","Localised study not elsewhere classified, with positron emission tomography [PET]","Localised study NEC with PET"
"9090600","1975","Ileal conduitography","Ileal conduitography"
"9090700","2014","Indirect cystography","Indirect cystography"
"9090800","1950","Ultrasound of other site","Ultrasound of other site"
"9090801","1949","High intensity focused ultrasound [HIFUS]","High intensity focused ultrasound"
"9090900","1988","Radiography of other region","Radiography of other region"
"9091000","2014","Nuclear medicine study of other region or organ","Nuclear med study of other region/organ"
"9091100","1948","Duplex ultrasound of vessels of other sites","Duplex ultrasound of vessels of other"
"9091200","1959","Computerised tomography of spine, unspecified region","CT of spine unspecified region"
"9091201","1959","Computerised tomography of spine with intravenous contrast medium, unspecified region","CT spine w IV CM unspecified region"
"9094000","889","Duodenal-jejunal bypass [DJ bypass]","Duodenal-jejunal bypass [DJ bypass]"
"9094100","889","Ileal interposition","Ileal interposition"
"9094200","889","Removal of gastric band","Removal of gastric band"
"9094201","889","Laparoscopic removal of gastric band","Laparoscopic removal of gastric band"
"9094202","889","Endoscopic removal of gastric band","Endoscopic removal of gastric band"
"9094300","889","Other procedures for obesity","Other procedures for obesity"
"9094301","889","Other laparoscopic procedures for obesity","Other lap procedures for obesity"
"9094302","889","Other endoscopic procedures for obesity","Other endoscopic procedures for obesity"
"9095000","889","Insertion of gastric balloon","Insertion of gastric balloon"
"9095001","889","Removal of gastric balloon","Removal of gastric balloon"
"9095100","917","Fixation of large intestine","Fixation of large intestine"
"9095200","987","Incision of abdominal wall","Incision of abdominal wall"
"9095300","889","Adjustment of gastric band","Adjustment of gastric band"
"9095400","868","Other reconstruction of oesophagus","Other reconstruction of oesophagus"
"9095600","962","Extracorporeal shockwave lithotripsy [ESWL] of biliary tract","ESWL of biliary tract"
"9095700","962","Extracorporeal shockwave lithotripsy [ESWL] of gallbladder","ESWL of gallbladder"
