"procedure_code","block","procedure_desc","procedure_short_desc"
"3651603","1049","Complete nephrectomy, bilateral","Complete nephrectomy, bilateral"
"3651604","1050","Laparoscopic complete nephrectomy for transplantation, living donor","Lap nephrectomy trnsplnt, living donor"
"3651605","1050","Complete nephrectomy for transplantation, living donor","Nephrectomy transplantation living donor"
"3651606","1050","Complete nephrectomy for transplantation, cadaver","Nephrectomy for transplantation cadaver"
"3651900","1051","Laparoscopic complete nephrectomy for removal of transplanted kidney","Lap nephrectomy R/O transplanted kidney"
"3651901","1051","Complete nephrectomy for removal of transplanted kidney","Nephrectomy for R/O transplanted kidney"
"3651902","1052","Laparoscopy complete nephrectomy complicated by previous surgery on same kidney","Lap nephrectomy prev surg same kidney"
"3651903","1052","Complete nephrectomy complicated by previous surgery on same kidney","Nephrectomy prev surg same kidney"
"3652200","1048","Laparoscopic partial nephrectomy","Laparoscopic partial nephrectomy"
"3652201","1048","Partial nephrectomy","Partial nephrectomy"
"3652500","1048","Laparoscopic partial nephrectomy complicated by previous surgery on same kidney","Lap prt nephrectomy prev surg kidney"
"3652501","1048","Partial nephrectomy complicated by previous surgery on same kidney","Prt nephrectomy prev surg same kidney"
"3652800","1053","Laparoscopic radical nephrectomy","Laparoscopic radical nephrectomy"
"3652801","1053","Radical nephrectomy","Radical nephrectomy"
"3652900","1053","Radical nephrectomy complicated by previous surgery on same kidney","Rad nephrectomy complic prev surg kidny"
"3653100","1054","Laparoscopic nephroureterectomy","Laparoscopic nephroureterectomy"
"3653101","1054","Nephroureterectomy","Nephroureterectomy"
"3653300","1054","Nephroureterectomy complicated by previous surgery on same kidney","Nephuretectomy complic prev surg kidny"
"3653700","1045","Exploration of perinephric area","Exploration of perinephric area"
"3653701","1045","Exploration of kidney","Exploration of kidney"
"3654000","1044","Nephrolithotomy with removal of <= 2 calculi","Nephrolithotomy w removal <= 2 calculi"
"3654300","1044","Nephrolithotomy with removal of >= 3 calculi","Nephrolithotomy w removal >= 3 calculi"
"3654600","1126","Extracorporeal shockwave lithotripsy [ESWL] of urinary tract","ESWL of urinary tract"
"3654900","1072","Ureterolithotomy ","Ureterolithotomy"
"3654901","1072","Laparoscopic ureterolithotomy","Laparoscopic ureterolithotomy"
"3655200","1056","Nephrostomy","Nephrostomy"
"3655201","1056","Pyelostomy","Pyelostomy"
"3655800","1055","Laparoscopic excision of renal cyst","Laparoscopic excision of renal cyst"
"3655801","1055","Excision of renal cyst","Excision of renal cyst"
"3655802","1055","Other local excision of renal lesion or tissue","Other local excision renal lesion/tissue"
"3656100","1047","Closed biopsy of kidney","Closed biopsy of kidney"
"3656400","1057","Laparoscopic pyeloplasty","Laparoscopic pyeloplasty"
"3656401","1057","Pyeloplasty","Pyeloplasty"
"3656700","1056","Laparoscopic pyeloplasty, on congenitally abnormal kidney or solitary kidney","Lap pyeloplty congen abn/solitary kidney"
"3656701","1056","Pyeloplasty for congenital abnormality of kidney or solitary kidney","Pyeloplasty congen abn/solitary kidney"
"3657000","1057","Laparoscopic pyeloplasty complicated by previous surgery on renal pelvis of same kidney","Lap pyeloplty prev surg ren pelv, kidney"
"3657001","1057","Pyeloplasty complicated by previous surgery on renal pelvis of same kidney","Pyeloplasty prev surg ren pelvis, kidney"
"3657300","1079","Laparoscopic repair of divided ureter","Laparoscopic repair of divided ureter"
"3657301","1079","Repair of divided ureter","Repair of divided ureter"
"3657600","1044","Exposure and exploration of kidney for trauma","Exposure & exploration kidney for trauma"
"3657900","1076","Laparoscopic partial ureterectomy","Laparoscopic partial ureterectomy"
"3657901","1076","Partial ureterectomy","Partial ureterectomy"
"3657902","1076","Laparoscopic complete ureterectomy","Laparoscopic complete ureterectomy"
"3657903","1076","Complete ureterectomy","Complete ureterectomy"
"3658500","1080","Laparoscopic transplantation of ureter into skin, unilateral","Lap trnsplnt ureter into skin unilateral"
"3658501","1080","Transplantation of ureter into skin, unilateral","Transplantation ureter into skin, uni"
"3658502","1080","Laparoscopic transplantation of ureter into skin, bilateral","Lap transplantation ureter into skin bil"
"3658503","1080","Transplantation of ureter into skin, bilateral","Transplantation of ureter into skin bil"
"3658800","1084","Laparoscopic reimplantation of ureter into bladder, unilateral","Lap re-impl ureter into bladder, uni"
"3658801","1084","Reimplantation of ureter into bladder, unilateral","Reimplantation ureter into bladder uni"
"3658802","1084","Laparoscopic reimplantation of ureter into bladder, bilateral","Lap re-impl ureter into bladder, bil"
"3658803","1084","Reimplantation of ureter into bladder, bilateral","Reimplantation ureter into bladder, bil"
"3658804","1055","Other local excision of renal lesion or tissue","Other local excision renal lesion/tissue"
"3659100","1085","Laparoscopic reimplantation of ureter into bladder with bladder flap, unilateral","Lap re-impl ureter in bladder flap uni"
"3659101","1085","Reimplantation of ureter into bladder with bladder flap, unilateral","Re-impl ureter into bladder w flap, uni"
"3659102","1085","Laparoscopic reimplantation of ureter into bladder with bladder flap, bilateral","Lap re-impl ureter in bladder w flap bil"
"3659103","1085","Reimplantation of ureter into bladder with bladder flap, bilateral","Re-impl ureter into bladder w flap, bil"
"3659104","1085","Reimplantation of ureter into bladder with psoas hitch, unilateral","Re-impl ureter in blader psoas htch uni"
"3659105","1085","Reimplantation of ureter into bladder with psoas hitch, bilateral","Re-impl ureter in bladder psoas htch bil"
"3700803","1094","Cystolithotomy","Cystolithotomy"
"3659400","1082","Laparoscopic transplantation of ureter into intestine, unilateral","Lap trnsplnt ureter into intestine, uni"
"3659401","1082","Transplantation of ureter into intestine, unilateral","Transplantation ureter into intest uni"
"3659402","1082","Laparoscopic transplantation of ureter into intestine, bilateral","Lap trnsplnt ureter into intestine, bil"
"3659403","1082","Transplantation of ureter into intestine, bilateral","Transplantation ureter into intest, bil"
"3659700","1081","Laparoscopic transplantation of ureter into other ureter","Lap trnsplnt of ureter into other ureter"
"3659701","1081","Transplantation of ureter into other ureter","Transplantation ureter into other ureter"
"3660000","1082","Laparoscopic transplantation of ureter into isolated bowel segment, unilateral","Lap trnsplt ureter into bowel seg, unil"
"3660001","1082","Transplantation of ureter into isolated bowel segment, unilateral","Trnsplt ureter into isol bowel seg, unil"
"3660002","1129","Formation of incontinent intestinal urinary reservoir","Formation incontinent intest urin resv"
"3660300","1082","Laparoscopic transplantation of ureter into isolated bowel segment, bilateral","Lap trnsplt ureter into bowel seg bil"
"3660301","1082","Transplantation of ureter into isolated bowel segment, bilateral","Trnsplt ureter into isol bowel seg, bil"
"3660400","1042","Passage of ureteric stent via percutaneous nephrostomy tube using interventional techniques","Passage ureteric stent v nephrostomy tbe"
"3660500","1042","Insertion of ureteric stent with removal of calculus via nephrostomy tube","Ins uretc stnt w R/O calc v nphrstmy tbe"
"3660600","1129","Formation of continent intestinal urinary reservoir","Formation continent intest urin resv"
"3660601","1072","Transurethral drainage of intestinal urinary reservoir","Transurethral drain intest urinary resv"
"3660602","1072","Cutaneous drainage of intestinal urinary reservoir","Cutaneous drain intestinal urinary resv"
"3660603","1129","Formation of continent intestinal urinary reservoir with attachment of reservoir to urethra","Frm contint urin resv w atchmt ureth"
"3660700","1042","Insertion of ureteric stent with balloon dilation via nephrostomy tube","Ins uretc stnt balln dilat nphrstmy tbe"
"3660800","1069","Percutaneous replacement of ureteric stent","Percutaneous replacement ureteric stent"
"3660900","1087","Revision of intestinal urinary conduit","Revision of intestinal urinary conduit"
"3660901","1087","Revision of intestinal urinary reservoir","Revision of intestinal urinary reservoir"
"3660902","1087","Laparoscopic revision of ureterostomy","Laparoscopic revision of ureterostomy"
"3660903","1087","Revision of ureterostomy","Revision of ureterostomy"
"3661200","1070","Laparoscopic exploration of ureter","Laparoscopic exploration of ureter"
"3661201","1070","Exploration of ureter","Exploration of ureter"
"3661500","1071","Laparoscopic ureterolysis","Laparoscopic ureterolysis"
"3661501","1071","Ureterolysis","Ureterolysis"
"3661502","1078","Laparoscopic ureterolysis with repositioning of ureter","Lap ureterolysis w repositioning ureter"
"3661503","1078","Ureterolysis with repositioning of ureter","Ureterolysis w repositioning of ureter"
"3661800","1086","Laparoscopic reduction ureteroplasty","Laparoscopic reduction ureteroplasty"
"3661801","1086","Reduction ureteroplasty","Reduction ureteroplasty"
"3662100","1086","Closure of cutaneous ureterostomy","Closure of cutaneous ureterostomy"
"3662400","1056","Percutaneous nephrostomy","Percutaneous nephrostomy"
"3662700","1043","Percutaneous nephroscopy","Percutaneous nephroscopy"
"3662701","1047","Percutaneous nephroscopy with biopsy","Percutaneous nephroscopy with biopsy"
"3662702","1041","Percutaneous nephroscopy with extraction of renal calculus","Perc nephroscopy w extr renal calculus"
"3662703","1046","Percutaneous nephroscopy with diathermy of kidney","Perc nephroscopy w diathermy of kidney"
"3663300","1043","Percutaneous nephroscopy with incision of renal pelvis","Perc nephroscopy w incision renal pelvis"
"3663301","1043","Percutaneous nephroscopy with incision of renal calyx","Perc nephroscopy w incision renal calyx"
"3663302","1043","Percutaneous nephroscopy with incision of ureter","Perc nephroscopy with incision of ureter"
"3663900","1046","Percutaneous nephroscopy with fragmentation and extraction of <= 2 or less calculi","Perc nephroscopy frag & extr <=2 calc"
"3664500","1046","Percutaneous nephroscopy with fragmentation or extraction of single calculus >= 3 cm in any dimension, or for >= 3 calculi","Perc nephroscopy frag/extr >=3 calculi"
"3664900","1042","Replacement of nephrostomy drainage tube","Replacement nephrostomy drainage tube"
"3665000","1902","Removal of pyelostomy or nephrostomy tube","Removal pyelostomy or nephrostomy tube"
"3665200","1040","Retrograde pyeloscopy","Retrograde pyeloscopy"
"3665201","1041","Retrograde pyeloscopy with manipulation of renal calculus","Retrogd pyeloscopy w manip of ren calc"
"3665400","1047","Retrograde pyeloscopy with biopsy of kidney","Retrogd pyeloscopy w biopsy of kidney"
"3665401","1046","Retrograde pyeloscopy with diathermy to kidney","Retrogd pyeloscopy w diathermy to kidney"
"3665402","1041","Retrograde pyeloscopy with extraction of renal calculus","Retrogd pyeloscopy w extr of ren calc"
"3665600","1046","Retrograde pyeloscopy with fragmentation of renal calculus","Retrogd pyeloscopy w frag ren calc"
"3665601","1046","Retrograde pyeloscopy with fragmentation and extraction of renal calculus","Retrogd pyelosc w frag & extr ren calc"
"3666300","67","Insertion of sacral nerve electrodes","Insertion of sacral nerve electrodes"
"3666400","67","Replacement of sacral nerve electrodes","Replacement of sacral nerve electrodes"
"3666500","67","Adjustment of sacral nerve electrodes","Adjustment of sacral nerve electrodes"
"3666700","67","Removal of sacral nerve electrodes","Removal of sacral nerve electrodes"
"3680000","1090","Bladder catheterisation","Bladder catheterisation"
"3680001","1090","Endoscopic replacement of indwelling urinary catheter","Endosc replace indwel urinary catheter"
"3680002","1092","Replacement of cystostomy tube","Replacement of cystostomy tube"
"3680003","1090","Endoscopic removal of indwelling urinary catheter","Endosc R/O indwelling urinary catheter"
"3680300","1065","Ureteroscopy ","Ureteroscopy"
"3680301","1086","Endoscopic dilation of ureter","Endoscopic dilation of ureter"
"3680302","1068","Endoscopic manipulation of ureteric calculus via ureteroscopy","Endosc manip uretc calc w ureterosc"
"3680600","1075","Endoscopic biopsy of ureter","Endoscopic biopsy of ureter"
"3680601","1074","Endoscopic diathermy of ureter","Endoscopic diathermy of ureter"
"3680602","1068","Endoscopic extraction of ureteric calculus via ureteroscopy","Endosc extr ureteric calc via ureterosc"
"3680900","1074","Endoscopic fragmentation of ureteric calculus","Endosc fragmentation ureteric calculus"
"3680901","1074","Endoscopic destruction of ureteric lesion","Endoscopic destruction ureteric lesion"
"3681100","1114","Endoscopic insertion of urethral prosthesis","Endoscopic insertion urethral prosthesis"
"3681101","1114","Endoscopic insertion of urethral stent","Endoscopic insertion of urethral stent"
"3681200","1089","Cystoscopy ","Cystoscopy"
"3681201","1089","Cystoscopy through artificial stoma","Cystoscopy through artificial stoma"
"3681202","1095","Endoscopic division of intraluminal bladder adhesions","Endosc div intraluminal bladder adhes"
"3681500","1195","Endoscopic destruction of penile wart","Endoscopic destruction of penile wart"
"3681501","1116","Endoscopic destruction of urethral warts","Endoscopic destruction of urethral warts"
"3681800","1066","Endoscopic ureteric catheterisation with fluoroscopic imaging of upper urinary tract, unilateral","Endosc uretc cath fluorosc image UT uni"
"3681801","1066","Endoscopic ureteric catheterisation with fluoroscopic imaging of upper urinary tract, bilateral","Endosc uretc cath fluorosc image UT bil"
"3682100","1047","Endoscopic brush biopsy of renal pelvis","Endoscopic brush biopsy of renal pelvis"
"3682101","1067","Endoscopic insertion of ureteric stent","Endoscopic insertion of ureteric stent"
"3682102","1075","Endoscopic brush biopsy of ureter","Endoscopic brush biopsy of ureter"
"3682103","1067","Endoscopic replacement of ureteric stent","Endoscopic replacement of ureteric stent"
"3682400","1066","Endoscopic ureteric catheterisation, unilateral","Endoscopic ureteric cath, unilateral"
"3682401","1066","Endoscopic ureteric catheterisation, bilateral","Endoscopic ureteric cath, bilateral"
"3682500","1073","Endoscopic incision of pelviureteric junction or ureteric stricture","Endosc inc pelviuret jnct/uretc strictr"
"3682700","1108","Endoscopically controlled hydrodilation of bladder","Endosc controlled hydrodilation bladder"
"3683000","1073","Endoscopic ureteric meatotomy","Endoscopic ureteric meatotomy"
"3683300","1092","Endoscopic removal of foreign body from bladder","Endoscopic removal FB from bladder"
"3683301","1067","Endoscopic removal of ureteric stent","Endoscopic removal of ureteric stent"
"3683600","1098","Endoscopic biopsy of bladder","Endoscopic biopsy of bladder"
"3683900","1097","Endoscopic destruction of a single lesion of bladder <= 2 cm or tissue of bladder","Endosc dest bladder lsn / tiss <= 2 cm"
"3683901","1162","Endoscopic destruction of lesion of prostate","Endosc destruction lesion of prostate"
"3683902","1096","Endoscopic laser destruction of a single lesion of bladder <= 2 cm or tissue of bladder","Endosc lasr dest blader lsn tiss <= 2 cm"
"3683903","1162","Endoscopic resection of lesion of prostate","Endosc resection of lesion of prostate"
"3683904","1100","Endoscopic resection of a single lesion of bladder <= 2cm or tissue of bladder","Endosc resec lsn / tiss bladder <= 2cm"
"3684000","1097","Endoscopic destruction of a single lesion of bladder <= 2 cm or tissue of bladder","Endosc dest bladder lsn / tiss <= 2 cm"
"3684001","1096","Endoscopic laser destruction of a single lesion of bladder <= 2 cm or tissue of bladder","Endosc lasr dest blader lsn tiss <= 2 cm"
"3684002","1100","Endoscopic resection of a single lesion of bladder <= 2 cm or tissue of bladder","Endosc resec lsn / tiss bladder <= 2 cm"
"3684003","1096","Endoscopic destruction of a single lesion of bladder <= 2 cm or tissue of bladder","Endosc dest bladder lsn / tiss <= 2 cm"
"3684200","1092","Endoscopic lavage of blood clots from bladder","Endosc lavage blood clots from bladder"
"3684500","1097","Endoscopic destruction of single lesion of bladder > 2 cm in diameter","Endosc dest single lesion bladder > 2 cm"
"3684501","1097","Endoscopic destruction of multiple lesions of bladder","Endosc dest of multiple lesions bladder"
"3684502","1096","Endoscopic laser destruction of multiple lesions of bladder","Endosc laser dest mult lesions bladder"
"3684503","1096","Endoscopic laser destruction of a single lesion of bladder > 2 cm in diameter","Endosc laser dest sgl lsn bladder > 2 cm"
"3684504","1100","Endoscopic resection of a single lesion of bladder > 2 cm in diameter","Endosc resec single lsn bladder > 2 cm"
"3684505","1100","Endoscopic resection of multiple lesions of bladder","Endosc resection mult lesions bladder"
"3684506","1096","Endoscopic destruction of a single lesion of bladder > 2 cm in diameter","Endosc dest single lesion bladder > 2 cm"
"3684507","1096","Endoscopic destruction of multiple lesions of bladder","Endosc dest of multiple lesions bladder"
"3684800","1077","Endoscopic resection of ureterocele","Endoscopic resection of ureterocele"
"3685100","1092","Endoscopic administration of agent into bladder wall","Endosc admin of agt into bladder wall"
"3685400","1095","Endoscopic incision of bladder neck","Endoscopic incision of bladder neck"
"3685401","1115","Endoscopic incision of external urethral sphincter","Endosc incision ext urethral sphincter"
"3685402","1101","Endoscopic resection of bladder neck","Endoscopic resection of bladder neck"
"3685403","1118","Endoscopic resection of external urethral sphincter","Endosc resection ext urethral sphincter"
"3685700","1068","Endoscopic manipulation or extraction of ureteric calculus without ureteroscopy","Endoscopic manip/extr ureteric calculus"
"3686000","1065","Endoscopic examination of intestinal conduit","Endoscopic exam of intestinal conduit"
"4561100","1699","Mandibular condylectomy","Mandibular condylectomy"
"3686001","1065","Endoscopic examination of intestinal reservoir","Endoscopic exam of intestinal reservoir"
"3686300","1096","Litholapaxy of bladder","Litholapaxy of bladder"
"3700000","1102","Laparoscopic partial excision of bladder","Laparoscopic partial excision bladder"
"3700001","1102","Partial excision of bladder","Partial excision of bladder"
"3700400","1104","Laparoscopic repair of ruptured bladder","Laparoscopic repair ruptured bladder"
"3700401","1108","Other laparoscopic repair of bladder","Other laparoscopic repair bladder NEC"
"3700402","1108","Other repair of bladder","Other repair of bladder"
"3700403","1104","Repair of ruptured bladder","Repair of ruptured bladder"
"3700800","1093","Laparoscopic cystotomy [cystostomy]","Laparoscopic cystotomy [cystostomy]"
"3700801","1093","Cystotomy [cystostomy]","Cystotomy [cystostomy]"
"3700804","1099","Laparoscopic removal of foreign body from bladder","Lap removal foreign body from bladder"
"3700805","1099","Removal of foreign body of bladder","Removal of foreign body of bladder"
"3700806","1095","Division of intraluminal bladder adhesions","Division intraluminal bladder adhesions"
"3701100","1093","Percutaneous cystotomy [cystostomy]","Percutaneous cystotomy [cystostomy]"
"3701400","1102","Total excision of bladder","Total excision of bladder"
"3702000","1103","Laparoscopic excision of bladder diverticulum","Lap excision bladder diverticulum"
"3702001","1103","Excision of bladder diverticulum","Excision of bladder diverticulum"
"3702300","1105","Laparoscopic closure of cutaneous vesical fistula","Lap closure cutaneous vesical fistula"
"3702301","1105","Closure of cutaneous vesical fistula","Closure of cutaneous vesical fistula"
"3702900","1105","Laparoscopic closure of vesicovaginal fistula","Lap closure vesicovaginal fistula"
"3702901","1105","Closure of vesicovaginal fistula by abdominal approach","Abdominal closure vesicovaginal fistula"
"3703800","1105","Laparoscopic closure of vesicointestinal fistula","Lap closure of vesicointestinal fistula"
"3703801","1105","Closure of vesicointestinal fistula","Closure of vesicointestinal fistula"
"3704100","1092","Percutaneous [needle] aspiration of bladder","Perc [needle] aspiration of bladder"
"3704300","1110","Transvaginal needle suspension for stress incontinence","Transvaginl needle suspnsn stress incont"
"3704400","1109","Retropubic procedure for stress incontinence, male","Retropubic proc male stress incontinence"
"3704401","1110","Retropubic procedure for stress incontinence, female","Retropubic proc for female stress incont"
"3704402","1110","Revision of retropubic procedure for stress incontinence, female","Rev retropubic proc female stress incont"
"3704403","1109","Revision of retropubic procedure for stress incontinence, male","Rev retropubic proc, male stress incont"
"3704500","1108","Formation of continent valve","Formation of continent valve"
"3704700","1107","Laparoscopic enlargement of bladder","Lap enlargement bladder"
"3704701","1107","Enlargement of bladder","Enlargement of bladder"
"3705000","1106","Closure of bladder exstrophy","Closure of bladder exstrophy"
"3705300","1108","Laparoscopic bladder transection and reanastomosis to trigone","Lap bladder transect & re-anstms trigone"
"3705301","1108","Bladder transection and reanastomosis to trigone","Bladder transect & re-anstms to trigone"
"3720000","1166","Cryoablation of prostate","Cryoablation of prostate"
"3720001","1166","Microwave thermotherapy of prostate","Microwave thermotherapy of prostate"
"3720002","1166","High intensity focused ultrasound [HIFUS] (transrectal) of prostate","High intensity focused u/s prostate"
"3720003","1167","Suprapubic prostatectomy","Suprapubic prostatectomy"
"3720004","1167","Retropubic prostatectomy","Retropubic prostatectomy"
"3720005","1167","Other open prostatectomy","Other open prostatectomy"
"3720006","1166","Other closed prostatectomy","Other closed prostatectomy"
"3720100","1165","Transurethral needle ablation of prostate [TUNA]","Transurethral needle ablation prostate"
"3720300","1165","Transurethral resection of prostate [TURP]","Transurethral resection of prostate"
"3720301","1165","Transurethral needle ablation of prostate [TUNA]","Transurethral needle ablation prostate"
"3720302","1165","Transurethral electrical vaporisation of prostate","Trnsureth electrl vaporisation prostate"
"3720303","1166","Cryoablation of prostate","Cryoablation of prostate"
"3720304","1166","Microwave thermotherapy of prostate","Microwave thermotherapy of prostate"
"3720305","1166","High intensity focused ultrasound [HIFUS] (transrectal) of prostate","High intensity focused u/s prostate"
"3720306","1166","Other closed prostatectomy","Other closed prostatectomy"
"3720700","1166","Endoscopic laser ablation of prostate","Endoscopic laser ablation of prostate"
"3720701","1166","Endoscopic laser excision of prostate","Endoscopic laser excision of prostate"
"3720900","1167","Radical prostatectomy","Radical prostatectomy"
"3720901","1166","Laparoscopic radical prostatectomy","Laparoscopic radical prostatectomy"
"3721000","1167","Radical prostatectomy with bladder neck reconstruction","Rad prostatectomy w bladder neck recon"
"3721001","1166","Laparoscopic radical prostatectomy with bladder neck reconstruction","Lap rad prstectmy w bladder neck recon"
"3721100","1167","Radical prostatectomy with bladder neck reconstruction and pelvic lymphadenectomy","Rad prstectmy w recon, lymphadenectomy"
"3721101","1166","Laparoscopic radical prostatectomy with bladder neck reconstruction and pelvic lymphadenectomy","Lap rad prstectmy bldnk recon lmphad"
"3721200","1164","Biopsy of prostate","Biopsy of prostate"
"3721201","1161","Drainage of abscess of prostate","Drainage of abscess of prostate"
"3721202","1161","Incision of prostate","Incision of prostate"
"3721500","1163","Endoscopic biopsy of prostate","Endoscopic biopsy of prostate"
"4561400","1684","Reconstruction of eyelid","Reconstruction of eyelid"
"3721700","1160","Implantation of fiducial marker, prostate","Implantation of fiducial marker prostate"
"3721800","1163","Percutaneous [needle] biopsy of prostate","Percutaneous [needle] biopsy of prostate"
"3721801","1160","Administration of agent into prostate","Administration of agent into prostate"
"3721900","1163","Transrectal needle biopsy of prostate","Transrectal needle biopsy of prostate"
"3722100","1161","Endoscopic drainage of abscess of prostate","Endoscopic drainage abscess of prostate"
"3722300","1160","Insertion of prostatic stent/coil","Ins prostatic stent/coil"
"3722301","1160","Insertion of prostatic stent/coil, visual","Insertion prostatic stent/coil, visual"
"3722400","1162","Endoscopic destruction of lesion of prostate","Endosc destruction of lesion of prostate"
"3722401","1162","Endoscopic resection of lesion of prostate","Endosc resection of lesion of prostate"
"3722700","1160","Implantation of brachytherapy applicator, prostate","Impl brachythrpy applicator prostate"
"3730000","1122","Passage of urethral sounds","Passage of urethral sounds"
